{
    "php": {
        "prod": ["laravel/folio", "livewire/livewire", "livewire/volt", "livewire/flux", "livewire/flux-pro"],
        "dev": [],
        "remove": []
    },
    "js": {
        "prod": [],
        "dev": ["prettier", "prettier-plugin-blade", "@tailwindcss/typography"],
        "remove": []
    },
    "repos": [
        {
            "name": "flux-pro",
            "url": "composer.fluxui.dev",
            "auth": true
        }
    ],
    "artisan": ["folio:install", "volt:install"],
    "remove_files": ["resources/views/welcome.blade.php"]
}
