{
    "$schema": "../../config-schema.json",
    "php": {
        "prod": [],
        "dev": ["laravel/breeze"],
        "remove": []
    },
    "js": {
        "prod": [],
        "dev": [],
        "remove": []
    },
    "artisan": ["breeze:install react --typescript --no-interaction"],
    "npx": ["shadcn@latest init"],
    "repos": [],
    "remove_files": []
}
