{
    "$schema": "../../config-schema.json",
    "remove_files": ["resources/views/welcome.blade.php", "resources/js/bootstrap.js"],
    "repos": [],
    "php": {
        "prod": ["livewire/livewire", "livewire/volt", "laravel/folio"],
        "dev": ["wire-elements/wire-spy"],
        "remove": []
    },
    "js": {
        "prod": [],
        "dev": ["prettier", "prettier-plugin-blade", "@tailwindcss/typography", "@tailwindcss/forms"],
        "remove": ["axios"]
    },
    "artisan": ["folio:install", "volt:install"],
    "npx": [],
    "commands": ["git init", "git add .", "quiet:git commit -m \"initial\"", "quiet:./vendor/bin/pint"]
}
